A1: Instruções | B1: Custo
A2: readln(N); | B2: 1
A3: Cont:=1; | B3: 1
A4: Soma:=0; | B4: 1
A5: while Cont<=N do begin readln(Num); Soma:=Soma+Num; inc(Cont); end; | B5: 3n
A6: Total | B6: 3 + 3n

A1: Instruções | B1: Custo
A2: readln(X); | B2: 1
A3: readln(N); | B3: 1
A4: Soma:=0; | B4: 1
A5: I:=0; | B5: 1
A6: while I<=N do begin Produto:=1; J:=0; while J<I do begin Produto:=Produto*X; inc(J); end; Soma:=Soma + Produto inc(I); end; | B6: (N2 + N) / 2
A7: Total | B7: (N2 + N) / 2 + 4

A1: Quando I é igual a | B1: While mais interno é executado
A2: 0 | B2: 0
A3: 1 | B3: 1
A4: 2 | B4: 2
A5: 3 | B5: 3
A6: 4 | B6: 4
A7: 5 | B7: 5

A1: Instruções | B1: Custo
A2: readln(X); | B2: 1
A3: readln(N); | B3: 1
A4: Soma:=0; | B4: 1
A5: I:=0; | B5: 1
A6: while I<=N do begin Soma:=Soma*X+1; inc(I); end; | B6: 2 * N
A7: Total | B7: 2 * N + 4

A1: Complexidade | B1: Notação O
A2: 2n + 2 | B2: O(n)
A3: (n2 + n)/2 | B3: O(n2)
A4: log n + 4 | B4: O(log n)

A1: Ordens
A2: O(k), sendo k constante | B2: constante
A3: O(log n) | B3: logarítmica
A4: O(n) | B4: linear
A5: O(n2) | B5: quadrática
A6: O(n3) | B6: cúbica
A7: Kn | B7: exponencial

A1: n | B1: O(log n) | C1: O(n) | D1: O(n2) | E1: O(n3)
A2: 1 | B2: =LN(A2) -> 0,00 | C2: =A2 -> 1 | D2: =A2*A2 -> 1 | E2: =A2*A2*A2 -> 1
A3: 2 | B3: =LN(A3) -> 0.69314718055994529 | C3: =A3 -> 2 | D3: =A3*A3 -> 4 | E3: =A3*A3*A3 -> 8
A4: 3 | B4: =LN(A4) -> 1.0986122886681098 | C4: =A4 -> 3 | D4: =A4*A4 -> 9 | E4: =A4*A4*A4 -> 27
A5: 4 | B5: =LN(A5) -> 1.3862943611198906 | C5: =A5 -> 4 | D5: =A5*A5 -> 16 | E5: =A5*A5*A5 -> 64
A6: 5 | B6: =LN(A6) -> 1.6094379124341003 | C6: =A6 -> 5 | D6: =A6*A6 -> 25 | E6: =A6*A6*A6 -> 125
A7: 6 | B7: =LN(A7) -> 1.791759469228055 | C7: =A7 -> 6 | D7: =A7*A7 -> 36 | E7: =A7*A7*A7 -> 216
A8: 7 | B8: =LN(A8) -> 1.9459101490553132 | C8: =A8 -> 7 | D8: =A8*A8 -> 49 | E8: =A8*A8*A8 -> 343
A9: 8 | B9: =LN(A9) -> 2.0794415416798357 | C9: =A9 -> 8 | D9: =A9*A9 -> 64 | E9: =A9*A9*A9 -> 512
A10: 9 | B10: =LN(A10) -> 2.1972245773362196 | C10: =A10 -> 9 | D10: =A10*A10 -> 81 | E10: =A10*A10*A10 -> 729
A11: 10 | B11: =LN(A11) -> 2.3025850929940459 | C11: =A11 -> 10 | D11: =A11*A11 -> 100 | E11: =A11*A11*A11 -> 1000